{
  "match": "r1-m05",
  "scores": {
    "X": {"demanda": 5, "viabilidad": 7, "diferenciacion": 6, "business_case": 5, "encaje": 7, "academico": 7, "fatal": false, "fatal_motivo": ""},
    "Y": {"demanda": 5, "viabilidad": 7, "diferenciacion": 4, "business_case": 5, "encaje": 6, "academico": 6, "fatal": false, "fatal_motivo": ""}
  },
  "winner": "X",
  "reason": "X apunta a un hueco concreto (conciliación bancaria e imputación aprendida) que las fichas de Contafácil y Contable.CFE no cubren, frente a un comprador que ya paga por herramientas del rubro, mientras Y queda reducida a un segmento angosto, las pymes que no migran ni activan el módulo de stock de su proveedor, frente a gestionUltimate, Facture ERP y Fixed.",
  "survived": [
    "Competidores uruguayos de CFE a asiento ignorados: ahora están citados y la idea dejó de competir en eso",
    "Precio por empresa sobre un competidor con empresas ilimitadas: pasó a plan plano por estudio, declarado a validar",
    "Fichas de YoFacturo y Odoo mal leídas: reescrito y Odoo retirado",
    "Datos reales sin socio y sin camino de Ley 18.331: datos sintéticos, extracción local y LLM solo con datos anonimizados o consentimiento; R7 bien rebatido",
    "Sin meta de acierto ni línea de base de horas: meta y medición agregadas como supuesto"
  ],
  "standing": {
    "X": [
      "Demanda delgada: una sola oferta laboral sobre conciliación, sin ficha de cantidad de estudios ni de pago por conciliación; el precio plano de $U 3.000 a 6.000 queda por encima del plan más caro de Contafácil"
    ],
    "Y": [
      "El hueco depende de pymes que no migran ni activan el módulo de stock de su proveedor (Fixed lo vende aparte, Facture ERP y gestionUltimate lo integran), sin evidencia de que ese segmento exista y pague",
      "El dolor de la doble carga se apoya en blogs de un proveedor y no hay ficha de su costo en horas o ventas"
    ]
  }
}
