{
  "match": "r4-m01",
  "scores": {
    "X": {"demanda": 5, "viabilidad": 6, "diferenciacion": 3, "business_case": 5, "encaje": 7, "academico": 6, "fatal": false, "fatal_motivo": ""},
    "Y": {"demanda": 5, "viabilidad": 7, "diferenciacion": 4, "business_case": 5, "encaje": 7, "academico": 6, "fatal": false, "fatal_motivo": ""}
  },
  "winner": "Y",
  "reason": "X compite contra Nexura, que según las fichas ya hace en Uruguay lo mismo (PDF a datos con IA, avisos por WhatsApp, Ley 18.331), y su componente de IA depende de cláusulas de transferencia no confirmadas, mientras Y procesa localmente sin dependencia regulatoria ni de API externa y su hueco frente a Conty, aunque apoyado en silencio, no está tan cubierto.",
  "survived": [
    "Plan B sin imputaciones reales: reemplazado por historial sintético con comparación reglas contra embeddings; R7 bien rebatido (datos propios o sintéticos)",
    "Precio de referencia frente a Contafácil: rebatido, cae dentro de la banda Simple a Pro que ya se paga",
    "Alcance técnico: bancos nombrados (BROU e Itaú), vista multi-cliente quitada, piloto limitado a 1 estudio, hito 1 compara métodos",
    "Ley 18.331 y arquitectura del piloto: datos reales en Docker dentro del estudio, sin transferencia; roles y registro pasados a supuesto",
    "Dominio sin fuente: eliminado, costo USD 144 con fuente"
  ],
  "standing": {
    "X": [
      "Piloto y validación de pago dependen de corredores sin contacto; el plan B no prueba disposición a pagar",
      "Diferencia frente a Nexura es precio y una precisión medida, copiable, con anclas de precio contradictorias",
      "Demanda del segmento de 100 a 300 pólizas sin evidencia y solapado con Nexura desde 150",
      "Sin cláusulas de transferencia el componente de IA queda fuera de producción y la tesis se reduce a comparar parsers"
    ],
    "Y": [
      "Demanda apoyada en un aviso laboral y un blog interesado, sin señal de pago por conciliar ni tamaño de mercado",
      "Hueco frente a Conty (PDF y cuenta aprendida) solo por silencio de su página; copiable por Contafácil",
      "Sin estudio piloto, el aprendizaje se mide solo sobre historial sintético, con validez limitada"
    ]
  }
}
